{
  "author": "OpenAxolotl maintainer via the project's Blender kit generator",
  "generationMethod": "ai-generated",
  "tool": "Blender 4.0.2 headless, tools/blender/make_forest_kit.py (deterministic, --seed 11)",
  "prompt": "A clump of nine tall leaning blades, placed at a river's edge so the waterline reads from above. Vertex-coloured deep green to a pale straw tip; no materials or textures; part of the shared forest dressing kit.",
  "licenseTerms": "Apache-2.0 (project license, same as the generator script)"
}
