{
  "author": "OpenAxolotl maintainer via the project's Blender kit generator",
  "generationMethod": "ai-generated",
  "tool": "Blender 4.0.2 headless, tools/blender/make_forest_kit.py (deterministic, --seed 11)",
  "prompt": "A low forest-floor fern: a rosette of seven tapered fronds splayed from a common base, built for a ragged silhouette read at distance and in quantity. Vertex-coloured deep-green to pale tip; no materials or textures; part of the shared forest dressing kit.",
  "licenseTerms": "Apache-2.0 (project license, same as the generator script)"
}
