{
  "author": "OpenAxolotl maintainer (concept and Meshy generation), brought inside its budget in-repo by the project's headless Blender pipeline",
  "generationMethod": "ai-generated",
  "tool": "Meshy (image-to-3D), run by the maintainer OUTSIDE this repository, then reduced inside it by tools/decimate_model.py (headless Blender 4.0.2): the Draco-compressed export was decoded, coincident vertices welded, 1,991,318 triangles collapse-decimated to 20,000, the 2048 maps kept at their source resolution, and the result gated on two-way surface deviation and on open edges. Uploaded as reference/coral_cove/Coral_Cove_Canopy_Tree_2.glb.",
  "prompt": "Generated by the maintainer in Meshy; the exact Meshy prompt is theirs and is not recorded in this repository. The dense source is kept in reference/coral_cove/ so the reduction can be re-run at any ratio. The taller companion grove: five trees whose hero specimen carries two stacked crowns on a longer leaning trunk, where canopy_grove's spreads a single broad one. Same palette and same base treatment, so the two intercut as one forest. THE FIVE TREES ARE ONE MESH, with the same consequence as canopy_grove: placed whole, never scattered, until the loose parts are split into separate assets. Shipped at 20,000 triangles rather than the environment category's 200,000 ceiling, because what has to fit is the scene rather than the file; at that count the surface strays 0.26% of the bounding-box diagonal, well inside even the character-grade allowance, and a render at the shipped count shows the crowns, the sand caps and the coral dressing all intact.",
  "licenseTerms": "Meshy's terms of service govern the generated mesh and its maps; the maintainer generated the asset under their own Meshy account and contributed it to this repository. The in-repo Blender pass that reduces it is Apache-2.0 with the rest of the project, but it does not change the terms on the geometry it transforms. REVIEW NEEDED (REQ-021) before any redistribution that assumes a uniform Apache-2.0 grant over assets/: the project's promise to contributors is 'build your level out of our assets', which is a grant that cannot be made over geometry whose terms are someone else's."
}
