{
  "author": "OpenAxolotl maintainer via the project's Drift Fleet generator",
  "generationMethod": "ai-generated",
  "tool": "Blender 4.0.2 headless, tools/blender/make_drift_fleet.py (deterministic, --seed 11)",
  "prompt": "A pressurised polluting canister venting through five downward nozzles, with an amber hazard band. The body sits high so the shape suggests the aura volume beneath it.",
  "licenseTerms": "Apache-2.0 (project license, same as the generator script)"
}
