{
  "author": "OpenAxolotl maintainer via the project's Drift Fleet generator",
  "generationMethod": "ai-generated",
  "tool": "Blender 4.0.2 headless, tools/blender/make_drift_fleet.py (deterministic, --seed 11)",
  "prompt": "The Flagship: the source vessel the fleet launches from, and the only Drift Fleet machine built to be stood on. A twenty-two metre barge hull with four intake mouths below the waterline, a long open deck with three derrick gantries above it, and a shuttered core housing at the stern. Faceless and unmanned: no glass, no cabin, nothing that reads as occupied.",
  "licenseTerms": "Apache-2.0 (project license, same as the generator script)"
}
