{
  "author": "OpenAxolotl maintainer via the project's Blender kit generator",
  "generationMethod": "ai-generated",
  "tool": "Blender 4.0.2 headless, tools/blender/make_forest_kit.py (deterministic, --seed 11)",
  "prompt": "A mossy fallen trunk: a jittered horizontal cylinder with a broken stub at one end and a flattened moss cap along its top, giving horizontal relief to an otherwise flat forest floor. Vertex-coloured bark with a separate moss gradient; no materials or textures; part of the shared forest dressing kit.",
  "licenseTerms": "Apache-2.0 (project license, same as the generator script)"
}
