{
  "author": "OpenAxolotl maintainer (concept and Meshy generation), brought inside its budget in-repo by the project's headless Blender pipeline",
  "generationMethod": "ai-generated",
  "tool": "Meshy (image-to-3D), run by the maintainer OUTSIDE this repository, then reduced inside it by tools/decimate_model.py (headless Blender 4.0.2): the Draco-compressed export was decoded, coincident vertices welded, 1,984,122 triangles collapse-decimated to 10,000, the three 2048 maps kept at their source resolution -- the texture ceiling is applied by halving, and they already sat on it, and the result gated on two-way surface deviation and on open edges. The maps were renamed by the Principled BSDF input each one feeds, so Godot's extracted textures land on contract-conforming names.",
  "prompt": "Generated by the maintainer in Meshy; the exact Meshy prompt is theirs and is not recorded in this repository. The dense source is kept at reference/coral_cove/Hookline.glb so the reduction can be re-run at any ratio. SUPERSEDES the procedurally generated Hookline Rig from tools/blender/make_drift_fleet.py, whose provenance described it as 'a tall snagging rig: a mast and crossbar with three hooks hanging on lines, amber beacon at the peak'; that generator remains in the repository and still produces a valid prop. Shipped at the prop category's 10,000-triangle budget. This is the most forgiving of the three machines under reduction -- at 5,000 it still measured only 0.52% deviation, near the character-grade ceiling -- but it ships at the same count as its siblings so one number covers the fleet. Checked by render at the shipped count: the blue and yellow rig and its hanging hooks read clearly, which is what matters for this unit; its thin silhouette is the tell that a snag line is ahead.",
  "licenseTerms": "Meshy's terms of service govern the generated mesh and its maps; the maintainer generated the asset under their own Meshy account and contributed it to this repository. The in-repo Blender pass that reduces it is Apache-2.0 with the rest of the project, but it does not change the terms on the geometry it transforms. REVIEW NEEDED (REQ-021) before any redistribution that assumes a uniform Apache-2.0 grant over assets/, and it is sharper for this asset than for the hero: the project's promise to contributors is 'build your level out of our assets', which is a grant that cannot be made over geometry whose terms are someone else's."
}
