{
  "author": "User-supplied asset; game derivative prepared by Codex",
  "generationMethod": "ai-generated",
  "licenseTerms": "User supplied for this project. Exact source license and Meshy account terms were not provided; retained as unknown.",
  "tool": "Meshy (source version not provided); Blender 4.5.3 (derivative)",
  "prompt": "Original generation prompt not provided. User supplied Reference Image_2_Level_1.png as the visual reference."
}
